{
  "$schema": "../schemas/repository-activity.schema.json",
  "version": "2.0.0",
  "as_of": "2026-10-14T01:56:44Z",
  "source": "GitHub repository metadata",
  "items": [
    {
      "name": "GitHub Profile System",
      "repository": "afadlih/afadlih",
      "url": "https://github.com/afadlih/afadlih",
      "description": "Config files for my GitHub profile.",
      "language": "Python",
      "pushed_at": "2026-10-14T01:56:44Z"
    },
    {
      "name": "Ahmad Fadlih Portfolio",
      "repository": "afadlih/Ahmad-Fadlih-Portfolio",
      "url": "https://github.com/afadlih/Ahmad-Fadlih-Portfolio",
      "description": null,
      "language": "TypeScript",
      "pushed_at": "2026-08-12T03:44:57Z"
    },
    {
      "name": "Smart Clothesline IoT",
      "repository": "afadlih/smart-clothesline-iot-system",
      "url": "https://github.com/afadlih/smart-clothesline-iot-system",
      "description": null,
      "language": "TypeScript",
      "pushed_at": "2026-06-10T01:44:07Z"
    },
    {
      "name": "AI Content Strategy",
      "repository": "afadlih/AI-Content-Strategy---SEO-Assistant--Web-App-",
      "url": "https://github.com/afadlih/AI-Content-Strategy---SEO-Assistant--Web-App-",
      "description": null,
      "language": "TypeScript",
      "pushed_at": "2026-04-27T15:01:42Z"
    },
    {
      "name": "Next.js Framework Practice",
      "repository": "afadlih/Pemrograman_Berbasis_Framework_Semester_6",
      "url": "https://github.com/afadlih/Pemrograman_Berbasis_Framework_Semester_6",
      "description": null,
      "language": "TypeScript",
      "pushed_at": "2026-04-16T07:20:20Z"
    }
  ]
}
